{
 "$schema":"https://json-schema.org/draft/2020-12/schema",
 "$id":"urn:starry:setting:1",
 "type":"object","additionalProperties":false,
 "required":["schema_version","public_profile","runtime","compatibility","parameter_schema","opening_policy","media_refs","extensions"],
 "properties":{
  "schema_version":{"const":1},
  "public_profile":{"type":"object","additionalProperties":false,"required":["primary_locale","title","synopsis","experience"],"properties":{"primary_locale":{"enum":["zh-Hans","zh-Hant","en"]},"title":{"type":"string","minLength":1,"maxLength":80},"synopsis":{"type":"string","minLength":1,"maxLength":1000},"experience":{"type":"string","maxLength":2000},"cover_asset_id":{"type":"string","maxLength":160}}},
  "runtime":{"type":"object","additionalProperties":false,"required":["scene","goals","language_policy","blocks","block_order"],"properties":{
   "scene":{"type":"object","additionalProperties":false,"required":["location","event","initial_relation"],"properties":{"location":{"type":"string","minLength":1,"maxLength":4000},"time":{"type":"string","maxLength":4000},"event":{"type":"string","minLength":1,"maxLength":8000},"user_identity":{"type":"string","maxLength":4000},"initial_relation":{"enum":["strangers","new_acquaintance","pursuit","ambiguous","lovers","friends","mentor","rivals","childhood_friends","custom"]}}},
   "goals":{"type":"object","additionalProperties":false,"required":["primary","secondary","long_term","short_term","allow_switch"],"properties":{"primary":{"enum":["relationship","task","sandbox"]},"secondary":{"type":"array","maxItems":10,"items":{"type":"string","maxLength":80}},"long_term":{"type":"string","maxLength":8000},"short_term":{"type":"string","maxLength":8000},"allow_switch":{"type":"boolean"}}},
   "language_policy":{"type":"object","additionalProperties":false,"required":["default","allowed","thought_language","allow_mixing"],"properties":{"default":{"type":"string","minLength":2,"maxLength":16},"allowed":{"type":"array","minItems":1,"maxItems":20,"uniqueItems":true,"items":{"type":"string","minLength":2,"maxLength":16}},"thought_language":{"enum":["dialogue"]},"allow_mixing":{"type":"boolean"}}},
   "learning":{"type":"object","maxProperties":16},"performance_preferences":{"type":"object","maxProperties":32},
   "blocks":{"type":"object","maxProperties":128,"additionalProperties":{"type":"object","additionalProperties":false,"required":["kind","purpose","text"],"properties":{"kind":{"enum":["instruction","background","world_fact","example","stage","event","secret"]},"purpose":{"type":"string","maxLength":80},"text":{"type":"string","maxLength":65536},"disclosure":{"$ref":"#/$defs/rule"}}}},
   "block_order":{"type":"array","maxItems":128,"uniqueItems":true,"items":{"type":"string","minLength":1,"maxLength":80}}
  }},
  "compatibility":{"type":"object","additionalProperties":false,"required":["preferred"],"properties":{"required":{"$ref":"#/$defs/rule"},"preferred":{"type":"array","maxItems":32,"items":{"$ref":"#/$defs/rule"}}}},
  "parameter_schema":{"type":"object","maxProperties":32,"additionalProperties":{"type":"object","additionalProperties":false,"required":["type","label","default","change_policy"],"properties":{"type":{"enum":["enum","text","number"]},"label":{"type":"string","maxLength":80},"values":{"type":"array","maxItems":100,"uniqueItems":true,"items":{"type":"string","maxLength":120}},"default":{},"min":{"type":"number"},"max":{"type":"number"},"max_length":{"type":"integer","minimum":1,"maximum":64000},"change_policy":{"enum":["in_place","new_instance"]}}}},
  "opening_policy":{"type":"object","additionalProperties":false,"required":["mode","candidates"],"properties":{"mode":{"const":"three_authored_candidates"},"candidates":{"type":"array","minItems":3,"maxItems":3,"items":{"type":"object","additionalProperties":false,"required":["id","text","thought","emotion"],"properties":{"id":{"type":"string","minLength":1,"maxLength":80},"text":{"type":"string","minLength":1,"maxLength":2000},"thought":{"type":"string","minLength":1,"maxLength":500},"emotion":{"type":"string"},"style":{"type":"string","maxLength":80},"audio_asset_id":{"type":"string","maxLength":160}}}},"return_guidance":{"type":"string","maxLength":4000},"idle_guidance":{"type":"string","maxLength":4000}}},
  "media_refs":{"type":"object","maxProperties":16,"additionalProperties":{"type":"string","maxLength":160}},
  "required_features":{"type":"array","maxItems":32,"items":{"type":"string","maxLength":80}},
  "extensions":{"type":"object","maxProperties":32}
 },
 "$defs":{"rule":{"type":"object","additionalProperties":false,"properties":{"all":{"type":"array","minItems":1,"maxItems":128,"items":{"$ref":"#/$defs/rule"}},"any":{"type":"array","minItems":1,"maxItems":128,"items":{"$ref":"#/$defs/rule"}},"not":{"$ref":"#/$defs/rule"},"field":{"type":"string","maxLength":120},"op":{"type":"string","maxLength":40},"value":{}}}}
}
